{
  "meta": { "version": "0.1", "title": "Stage: Booking Engine (Glass)", "lang": "en", "seed": 56 },
  "canvas": { "width": 1200, "height": 600, "viewBox": "0 0 1200 600", "bg": "#0B0F14" },
  "theme": {
    "palette": {
      "bg": "#0B0F14",
      "fg": "rgba(234,242,255,0.92)",
      "primary": "#4F8CFF",
      "accent": "#8B5BFF",
      "muted": "rgba(234,242,255,0.60)"
    },
    "typography": { "fontFamily": "ui-sans-serif, system-ui, -apple-system, Segoe UI, Roboto, Helvetica, Arial", "baseSize": 16 }
  },
  "defs": {
    "motifs": [
      "lucide_calendar_clock",
      "lucide_timer",
      "lucide_map",
      "lucide_badge",
      "lucide_tag",
      "lucide_triangle_alert",
      "lucide_shuffle",
      "opeeps_effigy_manager_blazer_deep_flip"
    ],
    "raw": "\n      <linearGradient id=\"g_accent\" x1=\"0\" y1=\"0\" x2=\"1\" y2=\"1\">\n        <stop offset=\"0%\" stop-color=\"rgba(79,140,255,0.95)\"/>\n        <stop offset=\"100%\" stop-color=\"rgba(139,91,255,0.95)\"/>\n      </linearGradient>\n      <filter id=\"f_soft\" x=\"-20%\" y=\"-20%\" width=\"140%\" height=\"140%\">\n        <feGaussianBlur stdDeviation=\"14\"/>\n      </filter>\n      <filter id=\"f_glass\" x=\"-30%\" y=\"-30%\" width=\"160%\" height=\"160%\">\n        <feGaussianBlur stdDeviation=\"10\"/>\n      </filter>\n    "
  },
  "nodes": [
    { "id": "bg", "type": "rect", "attrs": { "data-role": "decor", "data-decor-type": "texture", "x": 0, "y": 0, "width": 1200, "height": 600, "fill": "#0B0F14" } },
    { "id": "orb1", "type": "circle", "attrs": { "data-role": "decor", "data-decor-type": "shadow", "cx": 260, "cy": 160, "r": 160, "fill": "rgba(79,140,255,0.16)", "filter": "url(#f_soft)" } },
    { "id": "orb2", "type": "circle", "attrs": { "data-role": "decor", "data-decor-type": "shadow", "cx": 980, "cy": 420, "r": 180, "fill": "rgba(139,91,255,0.14)", "filter": "url(#f_soft)" } },

    { "id": "panel_shadow", "type": "ellipse", "attrs": { "data-role": "decor", "data-decor-type": "shadow", "cx": 500, "cy": 438, "rx": 520, "ry": 120, "fill": "rgba(0,0,0,0.28)", "filter": "url(#f_soft)" } },
    { "id": "panel", "type": "rect", "attrs": { "data-role": "prop", "data-layer": "bg", "x": 80, "y": 170, "width": 760, "height": 340, "rx": 26, "fill": "rgba(255,255,255,0.04)", "stroke": "rgba(255,255,255,0.12)", "stroke-width": 1 } },

    { "id": "chip1", "type": "rect", "attrs": { "data-role": "prop", "data-layer": "bg", "x": 120, "y": 220, "width": 320, "height": 84, "rx": 18, "fill": "rgba(255,255,255,0.03)", "stroke": "rgba(255,255,255,0.10)", "stroke-width": 1 } },
    { "id": "i_cal", "type": "use", "attrs": { "data-role": "prop", "data-layer": "bg", "href": "#motif_lucide_calendar_clock", "x": 146, "y": 242, "width": 34, "height": 34, "opacity": 0.95 } },
    { "id": "t_cal", "type": "text", "attrs": { "data-role": "text", "data-layer": "text", "x": 196, "y": 256, "fill": "rgba(234,242,255,0.88)", "font-size": 13, "font-weight": 720 }, "text": "Time slots" },
    { "id": "s_cal", "type": "text", "attrs": { "data-role": "text", "data-layer": "text", "x": 196, "y": 278, "fill": "rgba(234,242,255,0.56)", "font-size": 12 }, "text": "Capacity-aware availability" },

    { "id": "chip2", "type": "rect", "attrs": { "data-role": "prop", "data-layer": "bg", "x": 460, "y": 220, "width": 340, "height": 84, "rx": 18, "fill": "rgba(255,255,255,0.03)", "stroke": "rgba(255,255,255,0.10)", "stroke-width": 1 } },
    { "id": "i_timer", "type": "use", "attrs": { "data-role": "prop", "data-layer": "bg", "href": "#motif_lucide_timer", "x": 486, "y": 242, "width": 34, "height": 34, "opacity": 0.95 } },
    { "id": "t_timer", "type": "text", "attrs": { "data-role": "text", "data-layer": "text", "x": 536, "y": 256, "fill": "rgba(234,242,255,0.88)", "font-size": 13, "font-weight": 720 }, "text": "Duration" },
    { "id": "s_timer", "type": "text", "attrs": { "data-role": "text", "data-layer": "text", "x": 536, "y": 278, "fill": "rgba(234,242,255,0.56)", "font-size": 12 }, "text": "Per-service time blocks" },

    { "id": "chip3", "type": "rect", "attrs": { "data-role": "prop", "data-layer": "bg", "x": 120, "y": 322, "width": 320, "height": 84, "rx": 18, "fill": "rgba(255,255,255,0.03)", "stroke": "rgba(255,255,255,0.10)", "stroke-width": 1 } },
    { "id": "i_map", "type": "use", "attrs": { "data-role": "prop", "data-layer": "bg", "href": "#motif_lucide_map", "x": 146, "y": 344, "width": 34, "height": 34, "opacity": 0.92 } },
    { "id": "t_map", "type": "text", "attrs": { "data-role": "text", "data-layer": "text", "x": 196, "y": 358, "fill": "rgba(234,242,255,0.88)", "font-size": 13, "font-weight": 720 }, "text": "Service area" },
    { "id": "s_map", "type": "text", "attrs": { "data-role": "text", "data-layer": "text", "x": 196, "y": 380, "fill": "rgba(234,242,255,0.56)", "font-size": 12 }, "text": "Zones + coverage rules" },

    { "id": "chip4", "type": "rect", "attrs": { "data-role": "prop", "data-layer": "bg", "x": 460, "y": 322, "width": 340, "height": 84, "rx": 18, "fill": "rgba(255,255,255,0.03)", "stroke": "rgba(255,255,255,0.10)", "stroke-width": 1 } },
    { "id": "i_badge", "type": "use", "attrs": { "data-role": "prop", "data-layer": "bg", "href": "#motif_lucide_badge", "x": 486, "y": 344, "width": 34, "height": 34, "opacity": 0.92 } },
    { "id": "t_badge", "type": "text", "attrs": { "data-role": "text", "data-layer": "text", "x": 536, "y": 358, "fill": "rgba(234,242,255,0.88)", "font-size": 13, "font-weight": 720 }, "text": "Skill match" },
    { "id": "s_badge", "type": "text", "attrs": { "data-role": "text", "data-layer": "text", "x": 536, "y": 380, "fill": "rgba(234,242,255,0.56)", "font-size": 12 }, "text": "Right tech, first time" },

    { "id": "tiny_tag", "type": "use", "attrs": { "data-role": "prop", "data-layer": "bg", "href": "#motif_lucide_tag", "x": 742, "y": 434, "width": 28, "height": 28, "opacity": 0.75 } },
    { "id": "tiny_warn", "type": "use", "attrs": { "data-role": "prop", "data-layer": "bg", "href": "#motif_lucide_triangle_alert", "x": 704, "y": 434, "width": 28, "height": 28, "opacity": 0.72 } },
    { "id": "tiny_shuffle", "type": "use", "attrs": { "data-role": "prop", "data-layer": "bg", "href": "#motif_lucide_shuffle", "x": 666, "y": 434, "width": 28, "height": 28, "opacity": 0.70 } },

    { "id": "owner", "type": "use", "attrs": { "data-role": "subject", "href": "#motif_opeeps_effigy_manager_blazer_deep_flip", "x": 840, "y": 168, "width": 320, "height": 392, "opacity": 0.96 } },

    { "id": "kicker", "type": "text", "attrs": { "data-role": "text", "data-layer": "text", "x": 600, "y": 64, "text-anchor": "middle", "fill": "rgba(234,242,255,0.66)", "font-size": 14, "letter-spacing": 1 }, "text": "{{slot:kicker}}" },
    { "id": "headline", "type": "text", "attrs": { "data-role": "text", "data-layer": "text", "x": 600, "y": 96, "text-anchor": "middle", "fill": "rgba(234,242,255,0.92)", "font-size": 28, "font-weight": 740 }, "text": "{{slot:headline}}" },
    { "id": "subhead", "type": "text", "attrs": { "data-role": "text", "data-layer": "text", "x": 600, "y": 126, "text-anchor": "middle", "fill": "rgba(234,242,255,0.64)", "font-size": 16 }, "text": "{{slot:subhead}}" }
  ],
  "animations": [],
  "a11y": { "title": "Booking engine glass scene", "desc": "A glassy booking engine panel with icons for time slots, duration, service area and skill match.", "reducedMotion": { "strategy": "none" } }
}

