{
  "meta": { "version": "0.1", "title": "Commerce: Handshake + Contract (Paper/Pencil)", "lang": "en", "seed": 31 },
  "canvas": { "width": 1200, "height": 600, "viewBox": "0 0 1200 600", "bg": "#0B0F14" },
  "theme": {
    "palette": {
      "bg": "#0B0F14",
      "fg": "rgba(234,242,255,0.92)",
      "primary": "#4F8CFF",
      "accent": "#8B5BFF",
      "muted": "rgba(234,242,255,0.60)"
    },
    "typography": { "fontFamily": "ui-sans-serif, system-ui, -apple-system, Segoe UI, Roboto, Helvetica, Arial", "baseSize": 16 }
  },
  "defs": {
    "motifs": [
      "paper_frame",
      "pencil_shade_tr",
      "pencil_shade_bl",
      "tape_strip",
      "opeeps_effigy_explaining",
      "opeeps_effigy_arms_crossed",
      "handshake_handdrawn",
      "contract_handdrawn"
    ],
    "raw": "\n      <linearGradient id=\"g_accent\" x1=\"0\" y1=\"0\" x2=\"1\" y2=\"1\">\n        <stop offset=\"0%\" stop-color=\"rgba(79,140,255,0.95)\"/>\n        <stop offset=\"100%\" stop-color=\"rgba(139,91,255,0.95)\"/>\n      </linearGradient>\n      <filter id=\"f_soft\" x=\"-20%\" y=\"-20%\" width=\"140%\" height=\"140%\">\n        <feGaussianBlur stdDeviation=\"14\"/>\n      </filter>\n    "
  },
  "nodes": [
    { "id": "bg", "type": "rect", "attrs": { "data-role": "decor", "x": 0, "y": 0, "width": 1200, "height": 600, "fill": "#0B0F14" } },
    { "id": "paper", "type": "use", "attrs": { "data-role": "decor", "href": "#motif_paper_frame", "x": 0, "y": 0, "width": 1200, "height": 600, "opacity": 0.85 } },
    { "id": "shade_tr", "type": "use", "attrs": { "data-role": "decor", "href": "#motif_pencil_shade_tr", "x": 900, "y": -30, "width": 300, "height": 180, "opacity": 0.18 } },
    { "id": "shade_bl", "type": "use", "attrs": { "data-role": "decor", "href": "#motif_pencil_shade_bl", "x": 0, "y": 460, "width": 280, "height": 160, "opacity": 0.18 } },

    { "id": "ground", "type": "ellipse", "attrs": { "data-role": "decor", "cx": 600, "cy": 474, "rx": 390, "ry": 58, "fill": "rgba(0,0,0,0.30)", "filter": "url(#f_soft)" } },

    { "id": "tape1", "type": "use", "attrs": { "data-role": "decor", "href": "#motif_tape_strip", "x": 0, "y": 120, "width": 140, "height": 70, "opacity": 0.28 } },
    { "id": "tape2", "type": "use", "attrs": { "data-role": "decor", "href": "#motif_tape_strip", "x": 1060, "y": 488, "width": 140, "height": 70, "opacity": 0.28 } },

    { "id": "p_left", "type": "use", "attrs": { "data-role": "subject", "href": "#motif_opeeps_effigy_explaining", "x": 220, "y": 134, "width": 340, "height": 404 } },
    { "id": "p_right", "type": "use", "attrs": { "data-role": "subject", "href": "#motif_opeeps_effigy_arms_crossed", "x": 660, "y": 134, "width": 340, "height": 404 } },

    { "id": "contract", "type": "use", "attrs": { "data-role": "prop", "href": "#motif_contract_handdrawn", "x": 520, "y": 190, "width": 210, "height": 160 } },
    { "id": "handshake", "type": "use", "attrs": { "data-role": "prop", "href": "#motif_handshake_handdrawn", "x": 494, "y": 320, "width": 252, "height": 168 } },

    { "id": "kicker", "type": "text", "attrs": { "data-role": "text", "x": 600, "y": 64, "text-anchor": "middle", "fill": "rgba(234,242,255,0.66)", "font-size": 14, "letter-spacing": 1 }, "text": "{{slot:kicker}}" },
    { "id": "headline", "type": "text", "attrs": { "data-role": "text", "x": 600, "y": 96, "text-anchor": "middle", "fill": "rgba(234,242,255,0.92)", "font-size": 28, "font-weight": 700 }, "text": "{{slot:headline}}" },
    { "id": "subhead", "type": "text", "attrs": { "data-role": "text", "x": 600, "y": 126, "text-anchor": "middle", "fill": "rgba(234,242,255,0.64)", "font-size": 16 }, "text": "{{slot:subhead}}" }
  ],
  "animations": [],
  "a11y": { "title": "Paper/pencil commerce scene illustration", "desc": "Paper frame, pencil shading, people, handshake and contract.", "reducedMotion": { "strategy": "none" } }
}
