{
  "meta": { "version": "0.1", "title": "Stage: People Roster (Hand-drawn)", "lang": "en", "seed": 41 },
  "canvas": { "width": 1200, "height": 680, "viewBox": "0 0 1200 680", "bg": "#0B0F14" },
  "theme": {
    "palette": {
      "bg": "#0B0F14",
      "fg": "rgba(234,242,255,0.92)",
      "primary": "#4F8CFF",
      "accent": "#8B5BFF",
      "muted": "rgba(234,242,255,0.60)"
    },
    "typography": { "fontFamily": "ui-sans-serif, system-ui, -apple-system, Segoe UI, Roboto, Helvetica, Arial", "baseSize": 16 }
  },
  "defs": {
    "motifs": [
      "doodle_dotfield",
      "doodle_corner_scribble",
      "doodle_sparkles",
      "opeeps_effigy_manager_blazer_deep",
      "opeeps_effigy_admin_button_pocket_light_flip",
      "opeeps_effigy_fieldtech_jacket_flip",
      "opeeps_effigy_support_coffee_light",
      "opeeps_effigy_elder_turtleneck_deep_flip",
      "opeeps_effigy_ops_shirtcoat",
      "toolbox_handdrawn",
      "calendar_handdrawn",
      "phone_handdrawn",
      "receipt_handdrawn"
    ],
    "raw": "\n      <linearGradient id=\"g_accent\" x1=\"0\" y1=\"0\" x2=\"1\" y2=\"1\">\n        <stop offset=\"0%\" stop-color=\"rgba(79,140,255,0.95)\"/>\n        <stop offset=\"100%\" stop-color=\"rgba(139,91,255,0.95)\"/>\n      </linearGradient>\n      <filter id=\"f_soft\" x=\"-20%\" y=\"-20%\" width=\"140%\" height=\"140%\">\n        <feGaussianBlur stdDeviation=\"14\"/>\n      </filter>\n      <pattern id=\"p_scribble\" width=\"22\" height=\"22\" patternUnits=\"userSpaceOnUse\">\n        <path d=\"M2 6c6-3 10-3 16 0\" fill=\"none\" stroke=\"rgba(234,242,255,0.03)\" stroke-width=\"2\" stroke-linecap=\"round\"/>\n        <path d=\"M3 16c5-2 9-2 14 0\" fill=\"none\" stroke=\"rgba(234,242,255,0.02)\" stroke-width=\"2\" stroke-linecap=\"round\"/>\n      </pattern>\n    "
  },
  "nodes": [
    { "id": "bg", "type": "rect", "attrs": { "data-role": "decor", "data-decor-type": "texture", "x": 0, "y": 0, "width": 1200, "height": 680, "fill": "#0B0F14" } },
    { "id": "panel_shadow", "type": "ellipse", "attrs": { "data-role": "decor", "data-decor-type": "shadow", "cx": 600, "cy": 458, "rx": 520, "ry": 170, "fill": "rgba(0,0,0,0.30)", "filter": "url(#f_soft)" } },
    { "id": "panel", "type": "rect", "attrs": { "data-role": "prop", "data-layer": "bg", "x": 70, "y": 150, "width": 1060, "height": 500, "rx": 28, "fill": "rgba(255,255,255,0.02)", "stroke": "rgba(255,255,255,0.08)", "stroke-width": 1 } },

    { "id": "spark_tl", "type": "use", "attrs": { "data-role": "decor", "data-decor-type": "accent", "href": "#motif_doodle_sparkles", "x": 18, "y": 20, "width": 96, "height": 96, "opacity": 0.30 } },
    { "id": "dots_tr", "type": "use", "attrs": { "data-role": "decor", "data-decor-type": "accent", "href": "#motif_doodle_dotfield", "x": 1082, "y": 20, "width": 96, "height": 96, "opacity": 0.26 } },
    { "id": "scribble_br", "type": "use", "attrs": { "data-role": "decor", "data-decor-type": "accent", "href": "#motif_doodle_corner_scribble", "x": 1108, "y": 620, "width": 80, "height": 56, "opacity": 0.22 } },

    { "id": "p1", "type": "use", "attrs": { "data-role": "subject", "href": "#motif_opeeps_effigy_manager_blazer_deep", "x": 120, "y": 190, "width": 260, "height": 320, "opacity": 0.96 } },
    { "id": "p2", "type": "use", "attrs": { "data-role": "subject", "href": "#motif_opeeps_effigy_admin_button_pocket_light_flip", "x": 380, "y": 190, "width": 260, "height": 320, "opacity": 0.96 } },
    { "id": "p3", "type": "use", "attrs": { "data-role": "subject", "href": "#motif_opeeps_effigy_fieldtech_jacket_flip", "x": 640, "y": 190, "width": 260, "height": 320, "opacity": 0.96 } },
    { "id": "p4", "type": "use", "attrs": { "data-role": "subject", "href": "#motif_opeeps_effigy_support_coffee_light", "x": 900, "y": 190, "width": 260, "height": 320, "opacity": 0.96 } },
    { "id": "p5", "type": "use", "attrs": { "data-role": "subject", "href": "#motif_opeeps_effigy_elder_turtleneck_deep_flip", "x": 270, "y": 380, "width": 260, "height": 320, "opacity": 0.92 } },
    { "id": "p6", "type": "use", "attrs": { "data-role": "subject", "href": "#motif_opeeps_effigy_ops_shirtcoat", "x": 730, "y": 380, "width": 260, "height": 320, "opacity": 0.92 } },

    { "id": "cal", "type": "use", "attrs": { "data-role": "prop", "data-layer": "bg", "href": "#motif_calendar_handdrawn", "x": 92, "y": 560, "width": 120, "height": 92, "opacity": 0.45 } },
    { "id": "tool", "type": "use", "attrs": { "data-role": "prop", "data-layer": "bg", "href": "#motif_toolbox_handdrawn", "x": 540, "y": 560, "width": 120, "height": 92, "opacity": 0.40 } },
    { "id": "phone", "type": "use", "attrs": { "data-role": "prop", "data-layer": "bg", "href": "#motif_phone_handdrawn", "x": 990, "y": 560, "width": 96, "height": 74, "opacity": 0.40 } },
    { "id": "receipt", "type": "use", "attrs": { "data-role": "prop", "data-layer": "bg", "href": "#motif_receipt_handdrawn", "x": 312, "y": 560, "width": 110, "height": 84, "opacity": 0.40 } },

    { "id": "kicker", "type": "text", "attrs": { "data-role": "text", "x": 600, "y": 72, "text-anchor": "middle", "fill": "rgba(234,242,255,0.66)", "font-size": 14, "letter-spacing": 1 }, "text": "{{slot:kicker}}" },
    { "id": "headline", "type": "text", "attrs": { "data-role": "text", "x": 600, "y": 110, "text-anchor": "middle", "fill": "rgba(234,242,255,0.92)", "font-size": 30, "font-weight": 750 }, "text": "{{slot:headline}}" },
    { "id": "subhead", "type": "text", "attrs": { "data-role": "text", "x": 600, "y": 144, "text-anchor": "middle", "fill": "rgba(234,242,255,0.64)", "font-size": 16 }, "text": "{{slot:subhead}}" }
  ],
  "animations": [],
  "a11y": { "title": "People roster illustration", "desc": "A roster of diverse people motifs with calm hand-drawn decor.", "reducedMotion": { "strategy": "none" } }
}
