{
  "meta": { "version": "0.1", "title": "Dispatch: Route + Reassign (Hand-drawn)", "lang": "en", "seed": 22 },
  "canvas": { "width": 1200, "height": 600, "viewBox": "0 0 1200 600", "bg": "#0B0F14" },
  "theme": {
    "palette": {
      "bg": "#0B0F14",
      "fg": "rgba(234,242,255,0.92)",
      "primary": "#4F8CFF",
      "accent": "#8B5BFF",
      "muted": "rgba(234,242,255,0.60)"
    },
    "typography": { "fontFamily": "ui-sans-serif, system-ui, -apple-system, Segoe UI, Roboto, Helvetica, Arial", "baseSize": 16 }
  },
  "defs": {
    "motifs": ["map_pin_handdrawn", "van_handdrawn", "opeeps_effigy_explaining", "doodle_dotfield", "doodle_swoosh"],
    "raw": "\n      <linearGradient id=\"g_accent\" x1=\"0\" y1=\"0\" x2=\"1\" y2=\"1\">\n        <stop offset=\"0%\" stop-color=\"rgba(79,140,255,0.95)\"/>\n        <stop offset=\"100%\" stop-color=\"rgba(139,91,255,0.95)\"/>\n      </linearGradient>\n      <filter id=\"f_soft\" x=\"-20%\" y=\"-20%\" width=\"140%\" height=\"140%\">\n        <feGaussianBlur stdDeviation=\"14\"/>\n      </filter>\n      <pattern id=\"p_grid\" width=\"36\" height=\"36\" patternUnits=\"userSpaceOnUse\">\n        <path d=\"M36 0H0V36\" fill=\"none\" stroke=\"rgba(234,242,255,0.03)\" stroke-width=\"2\" stroke-linecap=\"round\"/>\n      </pattern>\n    "
  },
  "nodes": [
    { "id": "bg", "type": "rect", "attrs": { "data-role": "decor", "x": 0, "y": 0, "width": 1200, "height": 600, "fill": "#0B0F14" } },
    { "id": "grid", "type": "rect", "attrs": { "data-role": "decor", "x": 0, "y": 0, "width": 1200, "height": 600, "fill": "url(#p_grid)" } },
    { "id": "ground", "type": "ellipse", "attrs": { "data-role": "decor", "cx": 620, "cy": 474, "rx": 410, "ry": 60, "fill": "rgba(0,0,0,0.30)", "filter": "url(#f_soft)" } },

    { "id": "dots_tl", "type": "use", "attrs": { "data-role": "decor", "href": "#motif_doodle_dotfield", "x": 70, "y": 70, "width": 150, "height": 150, "opacity": 0.45 } },
    { "id": "swoosh_tr", "type": "use", "attrs": { "data-role": "decor", "href": "#motif_doodle_swoosh", "x": 820, "y": 120, "width": 260, "height": 120, "opacity": 0.45 } },

    {
      "id": "route",
      "type": "path",
      "attrs": {
        "data-role": "decor",
        "d": "M320 290 C 420 240, 520 240, 620 290 S 820 340, 940 274",
        "fill": "none",
        "stroke": "rgba(234,242,255,0.20)",
        "stroke-width": 10,
        "stroke-linecap": "round",
        "stroke-linejoin": "round",
        "stroke-dasharray": "1 22"
      }
    },
    {
      "id": "reroute",
      "type": "path",
      "attrs": {
        "data-role": "decor",
        "d": "M640 296 C 700 270, 760 258, 830 252",
        "fill": "none",
        "stroke": "url(#g_accent)",
        "stroke-width": 10,
        "stroke-linecap": "round",
        "stroke-linejoin": "round",
        "stroke-dasharray": "1 18",
        "opacity": 0.85
      }
    },

    { "id": "pin_a", "type": "use", "attrs": { "data-role": "prop", "href": "#motif_map_pin_handdrawn", "x": 230, "y": 166, "width": 160, "height": 130 } },
    { "id": "pin_b", "type": "use", "attrs": { "data-role": "prop", "href": "#motif_map_pin_handdrawn", "x": 850, "y": 146, "width": 170, "height": 140 } },
    { "id": "pin_c", "type": "use", "attrs": { "data-role": "prop", "href": "#motif_map_pin_handdrawn", "x": 650, "y": 268, "width": 150, "height": 120, "opacity": 0.8 } },

    { "id": "van", "type": "use", "attrs": { "data-role": "prop", "href": "#motif_van_handdrawn", "x": 520, "y": 302, "width": 240, "height": 160 } },
    { "id": "operator", "type": "use", "attrs": { "data-role": "subject", "href": "#motif_opeeps_effigy_explaining", "x": 70, "y": 228, "width": 260, "height": 320, "opacity": 0.9 } },

    { "id": "kicker", "type": "text", "attrs": { "data-role": "text", "x": 600, "y": 64, "text-anchor": "middle", "fill": "rgba(234,242,255,0.66)", "font-size": 14, "letter-spacing": 1 }, "text": "{{slot:kicker}}" },
    { "id": "headline", "type": "text", "attrs": { "data-role": "text", "x": 600, "y": 96, "text-anchor": "middle", "fill": "rgba(234,242,255,0.92)", "font-size": 28, "font-weight": 700 }, "text": "{{slot:headline}}" },
    { "id": "subhead", "type": "text", "attrs": { "data-role": "text", "x": 600, "y": 126, "text-anchor": "middle", "fill": "rgba(234,242,255,0.64)", "font-size": 16 }, "text": "{{slot:subhead}}" }
  ],
  "animations": [],
  "a11y": { "title": "Hand-drawn dispatch route scene", "desc": "Map pins and a van connected by sketchy routes.", "reducedMotion": { "strategy": "none" } }
}
