{
  "meta": { "version": "0.1", "title": "Stage: Backoffice (Paper/Pencil)", "lang": "en", "seed": 43 },
  "canvas": { "width": 1200, "height": 600, "viewBox": "0 0 1200 600", "bg": "#0B0F14" },
  "theme": {
    "palette": {
      "bg": "#0B0F14",
      "fg": "rgba(234,242,255,0.92)",
      "primary": "#4F8CFF",
      "accent": "#8B5BFF",
      "muted": "rgba(234,242,255,0.60)"
    },
    "typography": { "fontFamily": "ui-sans-serif, system-ui, -apple-system, Segoe UI, Roboto, Helvetica, Arial", "baseSize": 16 }
  },
  "defs": {
    "motifs": [
      "paper_frame",
      "pencil_shade_tr",
      "tape_strip",
      "credit_card_handdrawn",
      "check_badge_handdrawn",
      "contract_handdrawn",
      "receipt_handdrawn",
      "phone_handdrawn",
      "opeeps_effigy_finance_paper_deep",
      "opeeps_effigy_admin_button_pocket_light_flip",
      "opeeps_effigy_manager_blazer_flip"
    ],
    "raw": "\n      <linearGradient id=\"g_accent\" x1=\"0\" y1=\"0\" x2=\"1\" y2=\"1\">\n        <stop offset=\"0%\" stop-color=\"rgba(79,140,255,0.95)\"/>\n        <stop offset=\"100%\" stop-color=\"rgba(139,91,255,0.95)\"/>\n      </linearGradient>\n      <filter id=\"f_soft\" x=\"-20%\" y=\"-20%\" width=\"140%\" height=\"140%\">\n        <feGaussianBlur stdDeviation=\"14\"/>\n      </filter>\n    "
  },
  "nodes": [
    { "id": "bg", "type": "rect", "attrs": { "data-role": "decor", "data-decor-type": "texture", "x": 0, "y": 0, "width": 1200, "height": 600, "fill": "#0B0F14" } },
    { "id": "paper", "type": "use", "attrs": { "data-role": "decor", "data-decor-type": "texture", "href": "#motif_paper_frame", "x": 0, "y": 0, "width": 1200, "height": 600, "opacity": 0.85 } },
    { "id": "shade_tr", "type": "use", "attrs": { "data-role": "decor", "data-decor-type": "shadow", "href": "#motif_pencil_shade_tr", "x": 940, "y": -24, "width": 300, "height": 180, "opacity": 0.35 } },

    { "id": "tape", "type": "use", "attrs": { "data-role": "prop", "data-layer": "bg", "href": "#motif_tape_strip", "x": 0, "y": 585, "width": 140, "height": 70, "opacity": 0.22 } },

    { "id": "owner", "type": "use", "attrs": { "data-role": "subject", "href": "#motif_opeeps_effigy_manager_blazer_flip", "x": 120, "y": 170, "width": 320, "height": 392, "opacity": 0.96 } },
    { "id": "admin", "type": "use", "attrs": { "data-role": "subject", "href": "#motif_opeeps_effigy_admin_button_pocket_light_flip", "x": 440, "y": 190, "width": 320, "height": 392, "opacity": 0.92 } },
    { "id": "finance", "type": "use", "attrs": { "data-role": "subject", "href": "#motif_opeeps_effigy_finance_paper_deep", "x": 760, "y": 170, "width": 320, "height": 392, "opacity": 0.94 } },

    { "id": "contract", "type": "use", "attrs": { "data-role": "prop", "data-layer": "bg", "href": "#motif_contract_handdrawn", "x": 520, "y": 250, "width": 180, "height": 140, "opacity": 0.62 } },
    { "id": "card", "type": "use", "attrs": { "data-role": "prop", "data-layer": "bg", "href": "#motif_credit_card_handdrawn", "x": 690, "y": 270, "width": 190, "height": 140, "opacity": 0.62 } },
    { "id": "ok", "type": "use", "attrs": { "data-role": "prop", "data-layer": "bg", "href": "#motif_check_badge_handdrawn", "x": 640, "y": 340, "width": 140, "height": 110, "opacity": 0.58 } },
    { "id": "receipt", "type": "use", "attrs": { "data-role": "prop", "data-layer": "bg", "href": "#motif_receipt_handdrawn", "x": 350, "y": 290, "width": 160, "height": 130, "opacity": 0.54 } },
    { "id": "phone", "type": "use", "attrs": { "data-role": "prop", "data-layer": "bg", "href": "#motif_phone_handdrawn", "x": 880, "y": 286, "width": 150, "height": 120, "opacity": 0.52 } },

    { "id": "kicker", "type": "text", "attrs": { "data-role": "text", "x": 600, "y": 64, "text-anchor": "middle", "fill": "rgba(234,242,255,0.66)", "font-size": 14, "letter-spacing": 1 }, "text": "{{slot:kicker}}" },
    { "id": "headline", "type": "text", "attrs": { "data-role": "text", "x": 600, "y": 96, "text-anchor": "middle", "fill": "rgba(234,242,255,0.92)", "font-size": 28, "font-weight": 740 }, "text": "{{slot:headline}}" },
    { "id": "subhead", "type": "text", "attrs": { "data-role": "text", "x": 600, "y": 126, "text-anchor": "middle", "fill": "rgba(234,242,255,0.64)", "font-size": 16 }, "text": "{{slot:subhead}}" }
  ],
  "animations": [],
  "a11y": { "title": "Backoffice paper scene", "desc": "Owner, admin, finance with paper/pencil decor and billing props.", "reducedMotion": { "strategy": "none" } }
}
